[
  {
    "timestamp": "2025-08-09T23:40:32.571656+00:00",
    "source": "HackerNews",
    "title": "Nueva campaña de phishing financiero dirigida a MX",
    "threat_type": "phishing",
    "severity": "high",
    "slug": "phishing-financiero-mx",
    "url": "https://example.com/hackernews-item",
    "status": "active",
    "related_targets": [
      "dominio-banco-ejemplo.mx",
      "campaña-mail-aug"
    ],
    "notes": "Observado incremento en IOC relacionados."
  },
  {
    "timestamp": "2025-08-09T23:40:32.571656+00:00",
    "source": "BleepingComputer",
    "title": "CVE-2025-XXXX explotado en la naturaleza",
    "threat_type": "vuln",
    "severity": "critical",
    "slug": "cve-2025-xxxx",
    "url": "https://example.com/bleepingcomputer-article",
    "status": "active",
    "related_targets": [
      "docker-image:app-frontend",
      "azure-blob:public-assets"
    ],
    "notes": "Requiere verificación en containers y blobs."
  }
]